4939805-	0		9	Sun Oct 21 23:17:37 +0800 2012			3503708468356727	3503708468356727				3503708468356727	0		#	132	<a href=" rel="nofollow">企业微商宝</a>	不要为了任何人任何事折磨自己。比如不吃饭、哭泣、自闭、抑郁，这些都是傻瓜才做的事。当然，偶尔傻一下有必要，人生不必时时聪明。学会承受痛苦。有些话，适合烂在心里，有些痛苦，适合无声无息的忘记。当经历过，你成长了，自己知道就好。很多改变，不需要你自己说，别人会看得到。			2329597201	00	0	1397731630293
4939806-	2		7	Fri Dec 07 22:23:12 +0800 2012			3520727003667821	3520727003667821				3520727003667821	0		#	22	<a href=" rel="nofollow">企业微商宝</a>	每个人心中都有一座城，城中都会有个人，无论你走到哪里，总会因为一座城而想起一个人[心]			2329597201	00	0	1397731630293
4939807-	1		26	Sun Oct 28 23:29:00 +0800 2012			3506248056113089	3506248056113089				3506248056113089	0		#	121	<a href=" rel="nofollow">企业微商宝</a>	如果一个人真想见你，他总能找到办法，全世界都阻挡不了他。			2329597201	00	0	1397731630293
4939808-	0		0	Thu Jun 27 17:00:40 +0800 2013			3593848180108102	3593848180108102				3593848180108102	0		#	10	<a href=" rel="nofollow">Acer平板电脑</a>	女人好比梨，外甜内酸。吃梨的人不知道梨的心是酸的，因为吃到最后就把心扔了。男人就好比洋葱，要看到男人的心就需要一层一层去剥。但是剥到最后你才知道洋葱是没心的。

			2329597201	00	0	1397731630294
4939809-	4		7	Mon Jun 17 06:19:05 +0800 2013			3590062844950674	3590062844950674				3590062844950674	0		#	13	<a href=" rel="nofollow">Acer平板电脑</a>	只要我遇到了那个生命中的公主，我将有永不停止的动力，我的生活天天积极向上，充满阳光，我会为她改变，为她付出，充满上进心，为她拼搏事业，从此人生焕然一新。

			2329597201	00	0	1397731630294
4939810-	1		3	Wed Jun 12 20:55:03 +0800 2013			3588471354420672	3588471354420672				3588471354420672	0		#	19	<a href=" rel="nofollow">Acer平板电脑</a>	我希望能远走，逃离我的所知，逃离我的所有，逃离我的所爱。我想要出发，不是去飘渺幻境中的西印度，不是去远离其他南大陆的巨大海岛，我只想去任何地方，不论是村庄或者荒原，只要不是在这里就行。			2329597201	00	0	1397731630294
4939811-	2		2	Sun Jun 30 07:22:15 +0800 2013			3594789788369591	3594789788369591				3594789788369591	0		#	18	<a href=" rel="nofollow">Acer平板电脑</a>	唯有你愿意去相信，那样才能得到你想相信的。对的人终究会遇上，美好的人终究会遇到，只要让自己足够的美好。努力让自己独立坚强，这样才能有底气告诉我爱的人，我爱他。

			2329597201	00	0	1397731630295
4939812-	2		10	Tue Dec 18 08:02:09 +0800 2012			3524496579597077	3524496579597077				3524496579597077	0		#	106	<a href=" rel="nofollow">企业微商宝</a>	同一件事，想开了就是天堂，想不开就是地狱。。。[心]（转）			2329597201	00	0	1397731630295
4939813-	8		2	Tue Aug 13 22:56:30 +0800 2013			3610969961987034	3610969961987034				3610969961987034	0		#	47	<a href=" rel="nofollow">职场类</a>	1，最难留住的是光阴；2，最难把握的是机遇；3，最难做好的是细节；4，最难处理的是关系；5，最难改变的是习惯；6，最难得到的是人心；7，最难分配的是利益；8，最难控制的是情绪；9，最难战胜的是自己；10，最难找到的是知音；11，最难抵挡的是诱惑；12，最难提高的是水平。			2329597201	00	0	1397731630295
4939814-	1		0	Tue Feb 19 08:04:05 +0800 2013			3547327501629891	3547327501629891				3547327501629891	0		#	17	<a href=" rel="nofollow">Acer平板电脑</a>	守候着千年的爱恋，回首不复当年风景，蔚蓝的湖水倒映牵手的画面，被风吹皱的思念刺痛着从前，蜀山之巅，种下的情节，幻化成蝶，守护这份爱恋，一江春水只为你搁浅，千世缘，悠悠缠绵望不穿。			2329597201	00	0	1397731630296
4939815-	5		10	Tue Dec 18 12:07:58 +0800 2012			3524558441375478	3524558441375478				3524558441375478	0		#	153	<a href=" rel="nofollow">企业微商宝</a>	将来的你，一定会感谢现在拼命努力的你[心]（转）			2329597201	00	0	1397731630296
4939816-	0		11	Tue Nov 27 23:07:13 +0800 2012			3517114202168746	3517114202168746				3517114202168746	0		#	67	<a href=" rel="nofollow">企业微商宝</a>	忘字上面是个亡，下面是个心。想要忘记谁，只有死了心，你才忘得了。[心]			2329597201	00	0	1397731630296
4939817-	0		10	Wed Nov 07 12:08:56 +0800 2012			3509700786529056	3509700786529056				3509700786529056	0		#	59	<a href=" rel="nofollow">企业微商宝</a>	【女人输掉幸福婚姻的五个原因】1、因各种外在原因，草率嫁人；2、不认可门当户对的理儿，以为自己是个神；3、轻易听信男人的甜言蜜语以及忏悔并改过的承诺；4、为了男人和孩子，失去了自我空间及个性的延续发展；5、当双方之间的爱已不再，分手也许会是最好的选择。			2329597201	00	0	1397731630297
4939818-	0		3	Thu Jun 06 01:39:07 +0800 2013			3586006122955299	3586006122955299				3586006122955299	0		#	15	<a href=" rel="nofollow">Acer平板电脑</a>	I hope you will because I become happier, I will not let you drop more tears;, I will send you around the world rose a rose Your smile! 我希望你会因为我变得快乐一些，我不会让你再多掉一滴眼泪；如果一朵玫瑰换你一点笑颜，我会送你全世界的玫瑰！			2329597201	00	0	1397731630297
4939819-	2		13	Sat Sep 15 21:03:32 +0800 2012			3490628762062773	3490628762062773				3490628762062773	0		#	177	<a href=" rel="nofollow">企业微商宝</a>	【心理暗示】人生没有如果，只有后果和结果。�去的不再回来，回来的不再完美。生活有进退，输什麽也不能输心情。生活最大的幸福就是，坚信有人爱着我。对于过去，不可忘忘，但要放下。因为有明天，今天永远只是起跑线。生活简单就迷人，人心简单就幸福；学会简单其实就不简单。[酷]@揭秘人性的弱点			2329597201	00	0	1397731630297
4939820-	3		3	Tue Jun 18 10:27:15 +0800 2013			3590487686470137	3590487686470137				3590487686470137	0		#	12	<a href=" rel="nofollow">Acer平板电脑</a>	其实男生不是真的喜欢你不减肥，而是喜欢你爱吃还不肥；也不是真的喜欢你瘦，而是喜欢你瘦却有胸；也不是真喜欢你独立，而是他忙的时候别烦他。女孩子，太认真你就输了。
			2329597201	00	0	1397731630297
4939821-	5		33	Tue Oct 30 23:52:28 +0800 2012			3506978737498805	3506978737498805				3506978737498805	0		#	532	<a href=" rel="nofollow">企业微商宝</a>	你觉得孤独就对了，那是让你认识自己的机会。你觉得不被理解就对了，那是让你认清朋友的机会。你觉得黑暗就对了，那样你才分辨得出什么是你的光芒。你觉得无助就对了，那样你才能明白谁是你的贵人。你觉得迷茫就对了，谁的青春不迷茫。――刘同			2329597201	00	0	1397731630298
4939822-	6		1	Fri Sep 06 12:40:15 +0800 2013			3619512182324703	3619512182324703				3619512182324703	0		#	26	<a href=" rel="nofollow">职场类</a>	【工作中怎样摆脱无聊】1、弄清楚自己想做什么。 2、改变自己的想法。3、克服拖沓的习惯。4、 多去交往。5、学点新东西。6、清除干扰。7、把你的日程表填满。 8、培养兴趣爱好。9、试着去调节。 10、激发想象力。11、培养好奇心。12、开始新的挑战。			2329597201	00	0	1397731630298
4939823-	1		3	Fri May 31 07:10:10 +0800 2013			3583915106974388	3583915106974388				3583915106974388	0		#	13	<a href=" rel="nofollow">Acer平板电脑</a>	不要老是为了一些鸡毛蒜皮而贪小便宜，也不要为了一回绳头小利而斤斤计较，更不要为了一时的升官发财而明争暗斗。假如互不相让的尔虞我诈的话，到头来大家还是两败俱伤，你又何必呢。			2329597201	00	0	1397731630298
4939824-	1		2	Tue Jun 18 17:27:08 +0800 2013			3590593357595988	3590593357595988				3590593357595988	0		#	10	<a href=" rel="nofollow">Acer平板电脑</a>	人生旅途，修远漫漫，不如意事常八九，在秉持操守气节与正确目标的同时，学会应事物的“势”与“时”随机而动、伴风起舞，在挫折的拐角转个弯，便能收获成功彼岸的草丰水美，风细柳斜。转弯是一种智慧，而，如何转弯则是一种大智慧。			2329597201	00	0	1397731630299
4939825-	2		1	Sat Jul 06 15:55:45 +0800 2013			3597093338187627	3597093338187627				3597093338187627	0		#	26	<a href=" rel="nofollow">职场类</a>	【做职场幸福女人】1、有健康的身体;2、有幸福的家庭;3、有稳定的事业;4、会调教老公;5、微笑面对世界;6、心胸开阔;7、有健康的爱好;8、比较糊涂;9、有自己的朋友圈子;10、不会沉浸在过去的感情之中。#			2329597201	00	0	1397731630299
4939826-	7		3	Tue Jul 09 01:58:09 +0800 2013			3597969712535693	3597969712535693				3597969712535693	0		#	36	<a href=" rel="nofollow">Acer平板电脑</a>	有些你爱过的人的确只是个过程，他在你生命里出现，是为了使你茁壮，使你学会珍惜和付出，使你终于知道这一生你想要的是什么，你始终追寻的又是什么。这辈子能够相守固然是好，无法相守，也只是因为不适合。
			2329597201	00	0	1397731630299
4939827-	2		3	Sat Jun 08 09:27:02 +0800 2013			3586848657508608	3586848657508608				3586848657508608	0		#	21	<a href=" rel="nofollow">Acer平板电脑</a>	看的是书，读的却是世界；沏的是茶，尝的却是生活；人生就像一张有去无回的单车票。将生活中点滴的往事细细回味，伤心时的泪、开心时的醉，都是因追求而可贵。只要爱过等过付出过，天堂就不是传说。
			2329597201	00	0	1397731630300
4939828-	0		14	Tue Nov 27 21:14:08 +0800 2012			3517085747611564	3517085747611564				3517085747611564	0		#	89	<a href=" rel="nofollow">企业微商宝</a>	爱情，本就是件宁缺勿滥的事，急不得。[心]			2329597201	00	0	1397731630300
4939829-	6		2	Tue Jun 18 23:39:05 +0800 2013			3590686957692849	3590686957692849				3590686957692849	0		#	38	<a href=" rel="nofollow">Acer平板电脑</a>	忘记自己无法承载的东西，对自己就是一种最简单的释放；忘记一个错误的开始，就可能得到一个正确的结束；忘记曾经盲目的选择，就可以争取一个清醒的拥有。			2329597201	00	0	1397731630300
4939830-	3		4	Sat Jun 01 18:16:06 +0800 2013			3584445086712763	3584445086712763				3584445086712763	0		#	15	<a href=" rel="nofollow">Acer平板电脑</a>	人善心静，养血益气。人在受到善的撞击时，常会感到一股暖流沐浴全身。善是人体积极因素的启动器，让身体的每个细胞都充满善意，可以加快气血流通。做好的事，存好的心。
			2329597201	00	0	1397731630300
4939831-	1		8	Tue Nov 20 22:16:22 +0800 2012			3514564698198760	3514564698198760				3514564698198760	0		#	107	<a href=" rel="nofollow">企业微商宝</a>	看不清的东西 就让它继续模糊下去吧 有些事 有些爱 有些情 有些人 看得太透彻 反而会受伤害。			2329597201	00	0	1397731630301
4939832-	1		0	Fri Aug 02 08:15:55 +0800 2013			3606762089790527	3606762089790527				3606762089790527	0		#	0	<a href=" rel="nofollow">职场类</a>	领导，你忙对了地方，我再腾出精力来忙简化管理和思考大政方针；你忙我不忙，内查外攻。一切都就绪了，还得有随时查访下面的办法，体恤和解决职工的问题，做好单位的外交公关工作。			2329597201	00	0	1397731630301
4939833-	1		16	Tue Nov 06 17:01:42 +0800 2012			3509412071478979	3509412071478979				3509412071478979	0		#	103	<a href=" rel="nofollow">企业微商宝</a>	不要让那个喜欢你的人，撕心裂肺地为你哭那么一次。因为，你能把她伤害到那个样子的机会，只有一次。那一次以后，你就从不可或缺的人，变成可有可无的人了。即使，她还爱你，可是，总有一些，真的东西改变了。――《这些，都是你给我的爱》			2329597201	00	0	1397731630301
4939834-	3		1	Wed Apr 24 20:03:13 +0800 2013			3570701300945050	3570701300945050				3570701300945050	0		#	25	<a href=" rel="nofollow">Acer平板电脑</a>	每个人心里总会有那么些伤痕，随着时间的流逝，虽然不再当初的疼痛，却也会在心底隐隐作痛。有的时候，任性的想有个人静静的陪在自己身边，听自己抱怨，听自己唠叨，听自己的烦心事。			2329597201	00	0	1397731630302
4939835-	4		4	Fri May 10 01:44:16 +0800 2013			3576222946433105	3576222946433105				3576222946433105	0		#	43	<a href=" rel="nofollow">Acer平板电脑</a>	人生就像是高压锅，压力太大的时候你自己也就熟了。
			2329597201	00	0	1397731630302
4939836-	4		14	Mon Dec 03 18:43:02 +0800 2012			3519222053717784	3519222053717784				3519222053717784	0		#	141	<a href=" rel="nofollow">企业微商宝</a>	很多事情，你知道需要放下；但唯一遗憾的是，没有机会来得及好好道别。------《少年派的奇幻漂流》			2329597201	00	0	1397731630302
4939837-	3		0	Sun Jun 23 07:18:13 +0800 2013			3592252054361486	3592252054361486				3592252054361486	0		#	12	<a href=" rel="nofollow">Acer平板电脑</a>	“我爱你”这三个字，在由衷地感激、赞叹、关怀之际被吐露出来，展现出内心最完美纯净的本质――一种毫无犹疑敞开之际并作出承诺的力量。
			2329597201	00	0	1397731630302
4939838-	2		2	Wed Sep 18 01:54:11 +0800 2013			3623698252909891	3623698252909891				3623698252909891	0		#	3	<a href=" rel="nofollow">职场类</a>	清晰的目标，在商界这是大家都认为理所当然的事，而且经过研究，这个观念被加强。就像你可能听过的在哈佛商学院某班做的研究一样，在研究中，只有3%的毕业生写下了清晰的目标。20年后，这3%学生的身价是班中剩下所有学生的身价总和的10倍。			2329597201	00	0	1397731630303
4939839-	0		3	Thu Jul 04 16:40:04 +0800 2013			3596379723638067	3596379723638067				3596379723638067	0		#	5	<a href=" rel="nofollow">Acer平板电脑</a>	你可以让她知道你来往的朋友是谁，但是你们可以事先沟通好，大家可以在信任的基础上互相给对方空间。适当的时候，给点甜蜜的话吧，很多时候，女人就受你这一套。 

			2329597201	00	0	1397731630303
4939840-	1		0	Tue Jul 02 16:12:59 +0800 2013			3595648131791177	3595648131791177				3595648131791177	0		#	7	<a href=" rel="nofollow">职场类</a>	【正确的授权步骤】真正好的授权，应该具备几个步骤：1.跟部属讨论目标；2.给他方向；3.让他知道提供他多少资源；4.双方都要有风险管理的意识，确定下次汇报的时间，进程中间还是结束后；5. 让部门重新一下以上沟通中的要点，确认信息接收。			2329597201	00	0	1397731630303
4939841-	5		2	Wed Jun 12 08:31:04 +0800 2013			3588284120418906	3588284120418906				3588284120418906	0		#	29	<a href=" rel="nofollow">Acer平板电脑</a>	只有你尽力了之后，才有资格说自己的运气不好。
			2329597201	00	0	1397731630304
4939842-	0		4	Fri Oct 19 18:51:13 +0800 2012			3502916658923734	3502916658923734				3502916658923734	0		#	28	<a href=" rel="nofollow">企业微商宝</a>	 人在旅途，真理往往是简捷明了的，只是由于心灵受到尘埃的蒙蔽，使得简单的道理变得复杂起来，一旦想通了，明白了，人生之旅就不会左顾右盼、茫然不知所措了。屈原在《离骚》中感叹到：路漫漫其修远兮，吾将上下而求索。世界太大，生命太短，如果不导演好自己，怎能悟透人生的意义?			2329597201	00	0	1397731630304
4939843-	3		2	Tue Jul 09 05:52:05 +0800 2013			3598028584199816	3598028584199816				3598028584199816	0		#	10	<a href=" rel="nofollow">Acer平板电脑</a>	你就是最甜蜜的爱人，我希望听到的，不是你怎样地爱我，而是你一直在我身边的承诺，让我感到最幸福的事，正是你一直在。我认定你是我最甜蜜的爱人，我知道你永远也不会离开。

			2329597201	00	0	1397731630304
4939844-	1		14	Sat Nov 10 19:35:59 +0800 2012			3510900453896161	3510900453896161				3510900453896161	0		#	88	<a href=" rel="nofollow">企业微商宝</a>	有些人，用歌词做过签名，想表达某种含义，然后朋友问的时候怕被揭穿。但又声明这只是歌词。。。。。。干过这事的举个手！[嘻嘻]			2329597201	00	0	1397731630304
4939845-	4		3	Fri Jul 26 03:36:50 +0800 2013			3604155141121926	3604155141121926				3604155141121926	0		#	12	<a href=" rel="nofollow">职场类</a>	要把对方放到同一个高度来审视。任何好的人际关系都让人体验到自由、无拘无束的感觉。如果一方受到另一方的限制，或者一方需要看另一方的脸色行事，就无法建立起高质量的心理关系。			2329597201	00	0	1397731630305
4939846-	2		2	Wed Jun 05 19:46:10 +0800 2013			3585917303950137	3585917303950137				3585917303950137	0		#	20	<a href=" rel="nofollow">Acer平板电脑</a>	有时候不是不懂，只是不想懂；有时候不是不明白，而是明白了我也不知道该怎么做。			2329597201	00	0	1397731630305
4939847-	4		21	Mon Dec 10 10:04:12 +0800 2012			3521628196003354	3521628196003354				3521628196003354	0		#	250	<a href=" rel="nofollow">企业微商宝</a>	所谓美女，三分长相七分打扮、所谓气质，三分才气七分装蒜、所谓温柔，三分忍让七分压抑。[心]			2329597201	00	0	1397731630305
4939848-	1		1	Sun Jun 30 14:36:54 +0800 2013			3594899176086028	3594899176086028				3594899176086028	0		#	2	<a href=" rel="nofollow">职场类</a>	如果我说你用公司邮箱收发的邮件都被你的上司所看到，你是不是觉得天要塌下来了？ 如果不是，那就说明你很光明正大。其实很多人都不知道公司或上司能看到你的邮件，且公司也不会给员工发个警告，说要注意互相往来的E-mail。			2329597201	00	0	1397731630306
4939849-	8		2	Fri Jul 05 08:16:23 +0800 2013			3596615346864784	3596615346864784				3596615346864784	0		#	27	<a href=" rel="nofollow">Acer平板电脑</a>	一个人想要安定的时候你可以轻易的俘获他，而当他对世界充满好奇，你，基本上，用什么，都留不住。			2329597201	00	0	1397731630306
4939850-	9		3	Tue Jul 23 11:44:46 +0800 2013			3603190769748290	3603190769748290				3603190769748290	0		#	34	<a href=" rel="nofollow">职场类</a>	 【经营人脉十定律】1想钓鱼，就要像鱼那样思考；2不要总显示比别人聪明；3让对方做主角，自己甘愿做配角；4目中无人，让你一败涂地；5常与人争辩，你永难赢；6锋芒太露，下场不好；7刺猬原则，保持适当距离；8树一个敌，等于立一堵墙；9谦虚不虚伪，不苛求完美；10失言不如无言。			2329597201	00	0	1397731630306
4939851-	9		8	Sun May 05 09:16:08 +0800 2013			3574524723309523	3574524723309523				3574524723309523	0		#	34	<a href=" rel="nofollow">Acer平板电脑</a>	生活就像一架钢琴：白键代表快乐，黑键代表悲伤。只有黑白键的合奏才能弹出美妙的音乐。
			2329597201	00	0	1397731630307
4939852-	3		36	Wed Nov 21 08:27:10 +0800 2012			3514718402883425	3514718402883425				3514718402883425	0		#	153	<a href=" rel="nofollow">企业微商宝</a>	聪明的男人会把他的女人宠的无法无天，让别的男人都受不了她的臭脾气；二逼男人会用他的臭脾气把他的女人变得见到任何一个献殷勤的男人都有相见恨晚的感觉。。。[衰]			2329597201	00	0	1397731630307
4939853-	5		1	Wed Jun 19 03:47:05 +0800 2013			3590749369093392	3590749369093392				3590749369093392	0		#	12	<a href=" rel="nofollow">Acer平板电脑</a>	二十岁之前，我们应该学会忽略，而且必须学会忽略。忽略不是一种懦弱，而是一种生存技能，特别是一个人处于弱势的时候。			2329597201	00	0	1397731630307
4939854-	0		13	Wed Nov 21 14:55:11 +0800 2012			3514816050587003	3514816050587003				3514816050587003	0		#	95	<a href=" rel="nofollow">企业微商宝</a>	你现在是这个姿势吗？ 中枪的转！！！（转）[围观]			2329597201	00	0	1397731630307
4939855-	1		2	Tue Jul 02 18:17:04 +0800 2013			3595679350251346	3595679350251346				3595679350251346	0		#	2	<a href=" rel="nofollow">职场类</a>	政客与选民交流时，“我干得怎么样”或许是个不错的问题，但是对于那些想要增进自信的人来说，这是个蠢问题――主要是因为它让你充满不安全感，可能也不会得到诚挚的回应。			2329597201	00	0	1397731630308
4939856-	8		5	Wed May 29 23:58:15 +0800 2013			3583444028083562	3583444028083562				3583444028083562	0		#	18	<a href=" rel="nofollow">Acer平板电脑</a>	我们走遍了全世界，最后才发现，你的笑容才是我最美的风景。
			2329597201	00	0	1397731630308
4939857-	4		5	Tue Mar 05 23:42:07 +0800 2013			3552636995844560	3552636995844560				3552636995844560	0		#	38	<a href=" rel="nofollow">Acer平板电脑</a>	最该忘掉的事往往是最容易记住的事。记忆总是公然背叛我们的意志，该记住的记不住，不该记住的反而忘不了。许多痛苦产生的根源，就在于把不该记住的事情记得太牢。学会如何遗忘，也就拥有了一把开启快乐之门的钥匙。			2329597201	00	0	1397731630308
4939858-	2		0	Fri Aug 23 21:31:11 +0800 2013			3614572378430077	3614572378430077				3614572378430077	0		#	9	<a href=" rel="nofollow">职场类</a>	80/20准则：总的说来，这个准则说的就是大部分的成就来源于小部分的实际工作，反过来说就是，我们大部分的精力花费在那些不是很重要的事情上。找出你工作最关键的部分，尽可能地把你的精力放在那上面。			2329597201	00	0	1397731630308
4939859-	0		43	Wed Sep 19 09:19:47 +0800 2012			3491901212930781	3491901212930781				3491901212930781	0		#	476	<a href=" rel="nofollow">企业微商宝</a>	【心理分析】我们每个人几乎都在说不快乐的事，事业成功的说工作压力大，工作清闲的说这行没前途，没成家的说遇不到适合的人遇到的却说不合适。幸福像足球一样踢来踢去，烦恼像奖杯一样不可撒手。其实我们拥有的才是自己的幸福，争取的既是希望，失去的只是记忆，而快乐是源自内心。@揭秘人性的弱点			2329597201	00	0	1397731630309
4939860-	0		2	Thu Jun 20 03:27:04 +0800 2013			3591106723621604	3591106723621604				3591106723621604	0		#	6	<a href=" rel="nofollow">Acer平板电脑</a>	我不奢求能与你再相见，我只能做你梦里那片最轻柔的云彩，借几行炙热的倾诉贴近你遥想的身体，我会在心房为你腾出一个小小的角落，在那里安放我和你的一切。
			2329597201	00	0	1397731630309
4939861-	1		5	Sun Mar 31 04:13:08 +0800 2013			3561764895597415	3561764895597415				3561764895597415	0		#	18	<a href=" rel="nofollow">Acer平板电脑</a>	静下来想你，觉得一切都没好得不可思议。以前我不知道爱情这么美好，爱到深处这么美好。真不想让任何人来管我们。谁也管不着，和谁都无关。告诉你，一想到你，我这张丑脸上就泛起微笑。 

			2329597201	00	0	1397731630309
4939862-	9		32	Mon Dec 10 23:05:27 +0800 2012			3521824816184973	3521824816184973				3521824816184973	0		#	307	<a href=" rel="nofollow">企业微商宝</a>	 24岁跟你相恋，26岁嫁给你，28岁一个生命的诞生，29岁时孩子叫我们爸爸妈妈。33岁走过7年之痒，40岁激情褪去，我们仍然相爱。50岁孩子有自己的爱情。60岁我们一起去旅行，70岁我们子孙绕膝，76岁是我们的金婚。80岁不再恐惧死亡，因为你在。生命最后一天，我希望我先走或与你一起离开。[心]			2329597201	00	0	1397731630310
4939863-	4		2	Sun Mar 31 12:31:06 +0800 2013			3561890213489759	3561890213489759				3561890213489759	0		#	8	<a href=" rel="nofollow">Acer平板电脑</a>	只因在人群中多看了你一眼，从此开始延绵无尽的思念。当太平公主还是少女的时候，只因为在闹市的人群中看见薛绍一面，便认定他是托付终身的人。司马相如和卓文君，也因此而私奔相守一辈子.			2329597201	00	0	1397731630310
4939864-	4		0	Mon Mar 31 21:14:16 +0800 2014			3694293447459459	3694293447459459				3694293447459459	0		#	7	<a href=" rel="nofollow">定时showone</a>	【十二星座横刀夺爱指数排行】冠军（天秤座95%）、亚军（双子座85%）、季军（射手座80%）、第四名（白羊座、天蝎座65%）、第五名（狮子座、双鱼座60%）、第六名（水瓶座55%）、第七名（金牛座40%）、第八名（处女座35%）、第九名（巨蟹座30%）、第十名（摩羯座20%）			2329597201	00	0	1397731630310
4939865-	4		2	Thu Sep 26 09:45:08 +0800 2013			3626715878529451	3626715878529451				3626715878529451	0		#	16	<a href=" rel="nofollow">职场类</a>	在现世，能想明白、写清楚的年轻人越来越少，眼高手低的年轻人越来越多。一年至少写四篇文章，每篇至少两千字。写作的过程，也是沉静、思考和凝练的过程，仿佛躲开人群、屏息敛气、抬头看到明月当头。			2329597201	00	0	1397731630310
