247815-	0		3	Sat Jul 21 12:30:02 +0800 2012			3470205823085479	3470205823085479				3470205823085479	0			1	<a href=" rel="nofollow">Weico.iPhone</a>	少扯淡了。如果知道新浪围脖一天给淘宝带去的uv就知道所谓围脖营销就是大忽悠。围脖和所有1.0媒体一样，给企业带来的价值更多在确立品牌形象上而非销售上。这一点杜蕾斯相当把握到位。腾讯围脖搞的微卖场成功没？用户场景非常重要，别把互联网用户当傻子，在茶馆卖卖瓜子花生行，卖冰箱谁理你啊			1464793945	00	3470186239766393	1397718243391
247816-	0		0	Sun Oct 21 12:50:32 +0800 2012			3503550661196650	3503550661196650				3503550661196650	0			0	<a href=" rel="nofollow">天语云智能手机大黄蜂</a>	同理可证某些jy。//@许小年:此事足见国人之公平观，天天嘴上喊公平，一旦涉及自己的利益，便理直气壮地否认他人的权利，拥护歧视性政策。有这样的国民，就有以发展经济为名而强拆的政府，就有侵犯公民权利的各种管制。公平是人人拥有同样的权利。			1464793945	00	3503510769600202	1397718243392
247817-	0		9	Fri Nov 01 10:35:15 +0800 2013			3639774436674602	3639774436674602				3639774436674602	0			0	<a href=" rel="nofollow">微博 weibo.com</a>	看不懂……小微金融还是和集团本身的股权没关系，那集团的持股者（比如离职员工）手上的阿里集团股票还是相对贬值了？			1464793945	00	3639754568235388	1397718243392
247818-	0		1	Tue Jan 18 21:53:59 +0800 2011			5361718807	5361718807				2211101181272035684	0			0	<a href=" rel="nofollow">微博 weibo.com</a>	又被愤怒的小鸟又一次鄙视了，只有声音，画面不动。姐的手机不给力，姐的手机自绝于人民得了。			1464793945	00	0	1397718243393
247819-	0		6	Tue Feb 22 14:59:29 +0800 2011			6659744429	6659744429				2211102221973012895	0			0	<a href=" rel="nofollow">微博 weibo.com</a>	对了，最近发现“我买网”好像挺火的，也没见什么推广啊。我已经连续两三次在楼下看见他们送货员的自行车，堆满了各种大小印有logo的箱子。好随意哟，也不怕被人顺走了。			1464793945	00	0	1397718243393
247820-	0		0	Mon Jul 18 14:28:14 +0800 2011			14702232732	14702232732				3336514436246674	0			0	<a href=" rel="nofollow">微博 weibo.com</a>	虽然你丫写的歌让我无法入睡，还是祝你生日快乐//@乱等：嗯，最起码一定要有爱的代价和凡人歌。还有希望啊我终于失去了你啊当爱已成往事啊等等就不说了//@小灯的对面是我我：他的代表作难道不是鬼迷心窍、凡人歌和爱的代价么……			1464793945	00	14682794071	1397718243394
247821-	1		0	Fri Oct 04 21:01:07 +0800 2013			3629785102177305	3629785102177305				3629785102177305	0			0	<a href=" rel="nofollow">WeicoHD.iPad</a>	不行了，快笑死了。。。			1464793945	00	3629589886865230	1397718243394
247822-	0		1	Sun Aug 05 21:04:51 +0800 2012			3475771194682187	3475771194682187				3475771194682187	0			1	<a href=" rel="nofollow">Weico.iPhone</a>	林丹比四年前老了不少啊。继续帅气起来吧~			1464793945	00	0	1397718243395
247823-	0		0	Sun Nov 27 15:32:48 +0800 2011			3384365883501044	3384365883501044				3384365883501044	0			0	<a href=" rel="nofollow">iPhone客户端</a>	原来好久不见这首歌的粤语版叫不如不见......嗷呜，我真的好喜欢豆瓣电台红心兆赫，终于又可以边走路边听歌了。@Arays 一定帮我表达下仰慕之情！			1464793945	00	0	1397718243395
247824-	0		1	Sat Feb 18 12:12:20 +0800 2012			3414393629005003	3414393629005003				3414393629005003	0			0	<a href=" rel="nofollow">iPhone客户端</a>	地铁上，有两小孩一直在喊＂58同城＂，20几遍了。。。这招好像是对孩子的渗透力很强，要不58考虑搞个少儿频道？@reborncx			1464793945	00	0	1397718243396
247825-	0		4	Wed Mar 02 13:19:41 +0800 2011			6974515641	6974515641				2011103022542288652	0			4	<a href=" rel="nofollow">微博 weibo.com</a>	我个人觉得微博聊天有点鸡肋，信息交换私信足以。但是网页上沟通家长里短似乎没必要。再说新浪的那些明星用户谁跟你聊天呢。在媒体属性这一点上，新浪微博和饭否其实差别也挺大的，饭否好像还真是叨叨的地。新浪拉了一堆明星和140个中文字的信息量对媒体属性都有贡献。另，有点想回头去看《信息论》了			1464793945	00	0	1397718243396
247826-	0		0	Sun Nov 10 23:08:33 +0800 2013			3643225501640988	3643225501640988				3643225501640988	0			4	<a href=" rel="nofollow">微博 weibo.com</a>	必须极力推荐一下，双十一看一淘首页，人肉+内幕挑选，100%靠谱。绝不错过真折扣真优惠。			1464793945	00	0	1397718243397
247827-	0		0	Fri Jan 21 20:07:02 +0800 2011			5463828701	5463828701				2211101211330105501	0			1	<a href=" rel="nofollow">微博 weibo.com</a>	今天去逛了物流仓库，对电商有了一些新的了解。遥想当年读书的时候，对ERP有很多的憧憬，今天终于见到了一个庞大的实际应用ERP，我相信也是电商的最大ERP系统之一，确实很给力。很想同时参观一下京东的物流仓储体系啊！			1464793945	00	0	1397718243397
247828-	0		0	Tue Dec 07 15:16:58 +0800 2010			4146439701	4146439701				231101207835257296	0			0	<a href=" rel="nofollow">微博 weibo.com</a>	谢谢七哥~问跑跑公主好~			1464793945	00	4139034813	1397718243398
247829-	0		0	Tue Sep 13 10:13:12 +0800 2011			3357106363655598	3357106363655598				3357106363655598	0			1	<a href=" rel="nofollow">微博 weibo.com</a>	靠谱啊，慢豆瓣，恭喜!//@西门吹沙子：豆瓣会是一家熬出来的好公司 //@马伯乐招聘网:【豆瓣完成第三轮投资】			1464793945	00	3357078228030116	1397718243398
247830-	0		2	Thu May 05 16:10:53 +0800 2011			10130794014	10130794014				5603141548242855565	0			1	<a href=" rel="nofollow">微博 weibo.com</a>	随机抽了一些词，普吉岛、android 信号差、樱桃小丸子、陆小凤、里约大冒险等；都是自己随便想的一些词。从中文搜索质量来说，个人觉得baidu离google还是有差距。百科、知道的排前对搜索质量有很大提升，但还不够。粗浅的认为，差距不在相关性而在丰富性上。			1464793945	00	0	1397718243398
247831-	0		4	Thu Feb 02 10:00:55 +0800 2012			3408562351324438	3408562351324438				3408562351324438	0			0	<a href=" rel="nofollow">iPhone客户端</a>	昨晚居然梦到游台北，兴奋极了。还偶遇了去看女儿女婿的李开复老师，他们住在不能强拆年代久远的红色砖房里。我还要发微博说台北气候很似广州，好想以后能在这生活。正要去夜市吃小吃醒了，懊恼不已！！			1464793945	00	0	1397718243399
247832-	0		1	Fri Jan 27 20:00:12 +0800 2012			3406538838404526	3406538838404526				3406538838404526	0		#	1	<a href=" rel="nofollow">iPhone客户端</a>	写一两个还行的字还行，要写一篇让自己还看的过眼的字...简直是不可能完成的任务。			1464793945	00	0	1397718243399
247833-	0		3	Wed Oct 12 10:34:22 +0800 2011			3367620938701848	3367620938701848				3367620938701848	0			0	<a href=" rel="nofollow">微博 weibo.com</a>	我觉得育肥谈不上，贡献确实有。商场我建好了，开头没人气，房租便宜，你来摆摊能挣钱是你的选择。现在市场好了，要涨租。按照契约走，这也合情合理合法//@ArayS：可以这样理解：商城之前把口子开得大，让小卖家以为这跟C一样也是他们可以参与的游戏，市场培育好了，商城就想按它原本想好的玩法改…			1464793945	00	3367338460230932	1397718243399
247834-	0		1	Wed Jan 05 22:49:44 +0800 2011			4998913511	4998913511				2011101051061360905	0			0	<a href=" rel="nofollow">微博 weibo.com</a>	回家路上在环线地铁上看到卖唱的年轻人，第一次在车上而不是过道里。主唱拿一把吉他，每唱完一首说谢谢，然后拖着箱子走到下一个车厢；伴奏拿一个小铜片做的乐器打着拍子，背着一个包上面写着卖艺两字。如果你们能看到我想说你唱的真不错，祝福你们有成功的一天。			1464793945	00	0	1397718243400
247835-	0		0	Fri Jan 21 20:24:42 +0800 2011			5464363817	5464363817				2011101211719145422	0			0	<a href=" rel="nofollow">微博 weibo.com</a>	说点轻松的，《美人心计》真够扯滴！林心如的演技怎么还跟10年前一样，她一擦汗或者是摒起他的酒窝说话，我就想到紫薇。不过说句好话吧，他有的镜头还是蛮好看的。			1464793945	00	0	1397718243400
247836-	0		3	Thu Jun 07 10:05:16 +0800 2012			3454224317138215	3454224317138215				3454224317138215	0			0	<a href=" rel="nofollow">微博 weibo.com</a>	腾讯微博到底搞了神马花样，我亲爱的妈咪居然在腾讯微博收听了我！！！只能说，还好我不玩腾讯微博啊！			1464793945	00	0	1397718243400
247837-	0		0	Thu Jun 16 12:11:20 +0800 2011			12431979516	12431979516				5618665394174518228	0			0	</a>	这个我觉得还好吧。铁路晚点的情况很少发生，倒是民航不晚点不正常。还有指责高铁票不打折的，我觉得那个票价和打折飞机票比起来不算贵吧。定个特高的价格再打折有意思嘛？//@淘宝海力：先铁路非国有化，这个才有可能。要GCD从自己口袋掏钱赔偿可能吗。			1464793945	00	12431068922	1397718243401
247838-	0		0	Tue Dec 06 20:15:18 +0800 2011			3387698468240117	3387698468240117				3387698468240117	0		#	0	<a href=" rel="nofollow">iPhone客户端</a>	多谢hes请我吃?			1464793945	00	0	1397718243401
247839-	0		2	Wed Dec 28 16:15:48 +0800 2011			3395610728366039	3395610728366039				3395610728366039	0		#	0	<a href=" rel="nofollow">iPhone客户端</a>	要崩溃了，买书的时候应该考虑下页数的。不知道啥时候能看完 			1464793945	00	0	1397718243401
247840-	0		0	Thu Jul 26 11:50:19 +0800 2012			3472007759298343	3472007759298343				3472007759298343	0			0	<a href=" rel="nofollow">微博 weibo.com</a>	这也太大牌了！期待~//@饮茶YAMCHA: 期待//@塞将: 一淘推推，今天下午2点半!!亲们关注哈!			1464793945	00	3471980445110002	1397718243402
247841-	0		11	Tue Oct 09 22:38:11 +0800 2012			3499349902071600	3499349902071600				3499349902071600	0		#	5	<a href=" rel="nofollow">微博 weibo.com</a>	翻了一下过去一年的行程，发现去了很多地方，但是出片率是。。。。0%！在清迈没拍两张就发现sd卡满了，里面全是元旦在西安拍的文物。先出几张，得逼自己赶快出片放yupoo了。			1464793945	00	0	1397718243402
247842-	0		9	Fri Oct 07 23:37:36 +0800 2011			3366006106504960	3366006106504960				3366006106504960	0			0	<a href=" rel="nofollow">UC浏览器</a>	火车上遇到一个玩古玩的大叔让我帮他设置新买的ip4.我自己还没呢。不知道怎么卸载应用，想好久才想到itunes。乔帮主这样做到底有几层用意呢？p.s.:我觉得想学邓文迪的姑娘们，京沪高铁一等座性价比比头等仓高很多			1464793945	00	0	1397718243402
247843-	3		1	Sat Jan 11 18:20:17 +0800 2014			3665621021146468	3665621021146468				3665621021146468	0		#	0	<a href=" rel="nofollow">Weico.iPhone</a>	雨湖+夜湖，好景色			1464793945	00	0	1397718243403
247844-	0		7	Thu Jul 14 17:01:33 +0800 2011			14416519174	14416519174				5629130567325456011	0		#	3	<a href=" rel="nofollow">UC浏览器</a>	毕竟西湖六月中，风光不与四时同。接天荷叶无穷碧，映日荷花别样红！			1464793945	00	0	1397718243403
247845-	0		0	Sun Mar 02 10:24:08 +0800 2014			3683620587642101	3683620587642101				3683620587642101	0			4	<a href=" rel="nofollow">Weico.iPhone</a>	[伤心][伤心][泪][泪][泪][泪]			1464793945	00	3683612798929099	1397718243404
247846-	0		1	Thu Jan 31 14:53:09 +0800 2013			3540545072382199	3540545072382199				3540545072382199	0			1	<a href=" rel="nofollow">微博 weibo.com</a>	这世上好多事情的结果都是运气，但是幸福和快乐原来是一种能力。得失心降低，学会尊重自己都是对能力的修炼呀！			1464793945	00	0	1397718243404
247847-	0		3	Tue Aug 23 17:15:24 +0800 2011			3349602468346381	3349602468346381				3349602468346381	0		#	0	<a href=" rel="nofollow">微博 weibo.com</a>	2011/8/19 飞机上的夕阳			1464793945	00	0	1397718243404
247848-	0		13	Sat Dec 17 10:20:44 +0800 2011			3391535106609426	3391535106609426				3391535106609426	0			1	<a href=" rel="nofollow">iPhone客户端</a>	忽然记起来，我好像是一年前的今天正式回帝都来的			1464793945	00	0	1397718243404
247849-	0		3	Tue Apr 24 13:51:16 +0800 2012			3438336129668820	3438336129668820				3438336129668820	0			1	<a href=" rel="nofollow">微博 weibo.com</a>	5.1去爬泰山，舒缓下胸闷的情绪。			1464793945	00	0	1397718243405
247850-	0		1	Mon Jan 16 21:56:55 +0800 2012			3402581957192357	3402581957192357				3402581957192357	0			0	<a href=" rel="nofollow">微博 weibo.com</a>	想了一个下午，觉得在信息呈现过程中，应该把理性的信息和感性的信息分开来处理，最好不放在一个场景下出现。			1464793945	00	0	1397718243405
247851-	0		1	Tue Aug 23 16:59:07 +0800 2011			3349598370789209	3349598370789209				3349598370789209	0		#	0	<a href=" rel="nofollow">微博 weibo.com</a>	2011/08/19			1464793945	00	0	1397718243405
247852-	0		0	Tue May 08 08:11:02 +0800 2012			3443323933037690	3443323933037690				3443323933037690	0			0	<a href=" rel="nofollow">iPad客户端</a>	下了一大堆的阅读应用，忽觉有了大信息量恐惧症：那么多字看到啥时候去，还是呼呼大睡吧。看来无论买书or应用都该循序渐进呀!			1464793945	00	0	1397718243406
247853-	0		1	Tue Dec 06 15:21:02 +0800 2011			3387624412707669	3387624412707669				3387624412707669	0			0	<a href=" rel="nofollow">iPhone客户端</a>	困的很烦躁.....明年真的状态回勇吧！！			1464793945	00	0	1397718243406
247854-	0		1	Fri Mar 25 17:34:06 +0800 2011			8044473217	8044473217				201110325346241776	0			0	<a href=" rel="nofollow">微博 weibo.com</a>	腾讯有好多微博一看就是助理写的，比如刘若英和林心如……			1464793945	00	0	1397718243406
247855-	0		3	Sun Jan 29 22:45:46 +0800 2012			3407305284886992	3407305284886992				3407305284886992	0			0	<a href=" rel="nofollow">iPhone客户端</a>	还好没再抢七了...我都要爱上小德了！真不容易啊~第五盘开局我都觉得纳达尔会赢，明显状态更好些。永不放弃比斗志昂扬更重要啊！			1464793945	00	0	1397718243407
247856-	0		0	Tue Feb 14 10:30:24 +0800 2012			3412918424918139	3412918424918139				3412918424918139	0			0	<a href=" rel="nofollow">微博 weibo.com</a>	原来又是这家伙……			1464793945	00	3412907306170407	1397718243407
247857-	0		2	Sun Jan 01 18:55:33 +0800 2012			3397100482767849	3397100482767849				3397100482767849	0		#	0	<a href=" rel="nofollow">iPhone客户端</a>	老乌家羊肉泡馍，因为店面装修，没吃到@乱等 亲口中非常非常好吃的老刘家。这家也不错，点评真是出门利器			1464793945	00	0	1397718243407
247858-	0		0	Tue Oct 11 23:12:16 +0800 2011			3367449281956934	3367449281956934				3367449281956934	0			0	<a href=" rel="nofollow">微博 weibo.com</a>	我觉得最好的是去年和卖家的面谈，可以看到各种层次的卖家的生存状态。虽然做淘宝也是个人选择，要尊重淘宝的游戏规则，但我真觉得目前淘宝对真正想做好的小卖家责任尽得还是远远不够的。既然想做生态，想做政府，就不能完全靠市场竞争。淘宝真的需要一个经济实干家。//@李海涛：去年是搜索遭抗			1464793945	00	3367426974706058	1397718243408
247859-	0		1	Mon Mar 28 18:31:52 +0800 2011			8224293327	8224293327				221110328409339928	0			0	<a href=" rel="nofollow">微博 weibo.com</a>	每次遇到港澳通行证的事情就想骂娘！k，办个签注还要10个工作日。团体签就只有3个月1次和3个月两次！！小地方出生的人就会偷渡是吧？真不知道这么明显的nc和明显歧视性政策是哪个鬼想出来和哪个白痴同意执行的！			1464793945	00	0	1397718243408
247860-	0		5	Fri Feb 17 15:39:46 +0800 2012			3414083451381742	3414083451381742				3414083451381742	0			0	<a href=" rel="nofollow">微博 weibo.com</a>	再见，苏州街~~			1464793945	00	0	1397718243409
247861-	0		0	Wed Nov 09 15:27:56 +0800 2011			3377841679359252	3377841679359252				3377841679359252	0			0	<a href=" rel="nofollow">微博 weibo.com</a>	好不容易北京天晴、天蓝、银杏叶黄了，却必须困在会议室开会；还有啥比这更悲催吗？唉，求神拜佛祈祷这周末天气好~			1464793945	00	0	1397718243409
247862-	0		0	Sun Jun 19 13:18:18 +0800 2011			12620068371	12620068371				2111106192315057	0			1	</a>	李宗盛太狠了。我想起理智与情感演唱会，梁静茹说越来越听懂老豆的歌。年纪大了才知道字字句句都是百炼熬成的毒药			1464793945	00	12613818274	1397718243409
247863-	0		2	Thu Dec 16 16:18:03 +0800 2010			4494880481	4494880481				2211012161117592198	0		#	2	<a href=" rel="nofollow">UC浏览器</a>	雪白嫣红			1464793945	00	0	1397718243409
247864-	0		0	Sun May 20 13:42:47 +0800 2012			3447756079407661	3447756079407661				3447756079407661	0		#	1	<a href=" rel="nofollow">豆瓣FM</a>	分享 许巍 / 丁武 / 汪峰 / 高旗 & 超载 / 马上又 / 张楚 / 陈劲 / 李延亮 / 峦树 / 周晓欧 的单曲《礼物》（来自豆瓣FM-#私人兆赫#）   好久没听这首歌了，真是太喜欢了。这个年代没有音乐了，真是可悲。			1464793945	00	0	1397718243410
247865-	0		3	Sat Nov 02 22:05:03 +0800 2013			3640310431474537	3640310431474537				3640310431474537	0			1	<a href=" rel="nofollow">WeicoHD.iPad</a>	十年前，传媒行业也认为互联网是狼来了，纸媒和电视最终会被互联网所消灭。但最终互联网似乎是充分渗透到媒体中帮助了媒体的发展和变革。十年内倒下、走下坡路的互联网企业数不胜数，但四大传媒集团还是活得好好的。今天互联网企业对金融行业、通讯行业的进攻是否也是一样的结局呢？			1464793945	00	0	1397718243410
247866-	0		1	Sat Mar 29 14:26:04 +0800 2014			3693465944925894	3693465944925894				3693465944925894	0			1	<a href=" rel="nofollow">WeicoHD.iPad</a>	哇哈哈哈！			1464793945	00	3693436168929969	1397718243410
247867-	0		1	Tue Sep 13 11:43:44 +0800 2011			3357129146668637	3357129146668637				3357129146668637	0			1	<a href=" rel="nofollow">微博 weibo.com</a>	可儿姐姐，每个新的一天，我们都与你同行。			1464793945	00	3357126630681227	1397718243411
247868-	0		1	Sat Feb 09 23:16:57 +0800 2013			3543933353570398	3543933353570398				3543933353570398	0		#	0	<a href=" rel="nofollow">WeicoHD.iPad</a>	饺子上桌啦！恭祝各位关注我，爱我的亲们新年快快乐乐，身体健健康康，爱情甜甜蜜蜜，事业顺顺利利，家人和和美美！			1464793945	00	0	1397718243411
247869-	0		0	Mon Jan 10 23:46:20 +0800 2011			5134966837	5134966837				2211101101529199643	0		#	0	<a href=" rel="nofollow">UC浏览器</a>	首饰盒内景。价值3.5，商家太黑心了…			1464793945	00	0	1397718243412
247870-	0		1	Tue May 08 12:22:13 +0800 2012			3443387141251648	3443387141251648				3443387141251648	0			1	<a href=" rel="nofollow">iPhone客户端</a>	看了几篇阿尔法城网友结集的诗集＜绿萝集＞，好奇阿尔法的男女比例。词藻自是极优美的，也偶有令人击节赞叹的比喻。作为情诗送爱郎自是极佳。只是小女儿情态都表露无尽了呢！！说人话：那些诗总结起来就是闺怨二字有木有！！！哈哈，作者不会都是月亮组的吧？			1464793945	00	0	1397718243412
247871-	0		11	Sun Jan 23 18:59:37 +0800 2011			5530066975	5530066975				2011101231367894570	0			5	<a href=" rel="nofollow">微博 weibo.com</a>	最后还是狠心买了黄牛，一张加价400；比翻倍还多。泪....			1464793945	00	0	1397718243412
247872-	0		2	Tue Feb 07 11:05:13 +0800 2012			3410390480014197	3410390480014197				3410390480014197	0			0	<a href=" rel="nofollow">微博 weibo.com</a>	天意如此吧！死活想不起密码&找回密码失败……我真的尽力了~			1464793945	00	0	1397718243412
247873-	0		2	Sat Nov 02 21:27:20 +0800 2013			3640300952559077	3640300952559077				3640300952559077	0			0	<a href=" rel="nofollow">WeicoHD.iPad</a>	人家说四十不惑，看来我还需要10＋x年才能解开我内心新近冒出的种种、种种困惑。			1464793945	00	0	1397718243413
247874-	1		3	Sun Jan 12 15:34:53 +0800 2014			3665941785028444	3665941785028444				3665941785028444	0		#	0	<a href=" rel="nofollow">Weico.iPhone</a>	周末和朋友在咖啡馆喝喝茶，一个人把小日子过的太精彩美好是一种罪过～			1464793945	00	0	1397718243413
247875-	0		5	Sat Apr 21 22:45:24 +0800 2012			3437383381325247	3437383381325247				3437383381325247	0			0	<a href=" rel="nofollow">iPad客户端</a>	我最近是挺喜欢这样有追求有态度三观正常的女人。			1464793945	00	3437360685923380	1397718243413
247876-	0		1	Thu Jan 30 23:10:53 +0800 2014			3672579518831637	3672579518831637				3672579518831637	0			4	<a href=" rel="nofollow">iPhone客户端</a>	哈哈哈 //@茶与潘:我不行了。。			1464793945	00	3672573320363610	1397718243414
247877-	0		12	Sat Jan 08 19:48:00 +0800 2011			5073319121	5073319121				2211101081488877439	0			1	<a href=" rel="nofollow">微博 weibo.com</a>	今天的晚餐：东来顺的牛排（自己用黄油煎的，好香啊）配智利红酒Montes‘，还有7-11买的蔬菜沙拉，一会还有21cake的布朗尼蛋糕。工具材料大部分来自网购：当当买的苏泊尔平底锅49，今天在超市看卖89；红酒及红酒杯来自淘宝，也比超市便宜50%+。但是吃的大部分从线下购买----主要考虑新鲜问题。			1464793945	00	0	1397718243414
247878-	1		2	Sun Mar 23 19:24:17 +0800 2014			3691366657833428	3691366657833428				3691366657833428	0		#	0	<a href=" rel="nofollow">Weico.iPhone</a>	为什么春天才刚来，我却有一种对芳菲尽的惶恐。这是什么中二病？得治			1464793945	00	0	1397718243414
247879-	0		2	Mon Feb 10 20:27:15 +0800 2014			3676524618622453	3676524618622453				3676524618622453	0			1	<a href=" rel="nofollow">WeicoHD.iPad</a>	对阿里对高德都算是好消息吧。不过对高德员工倒未必是，要融入这家疯狂的公司不太容易。。。			1464793945	00	3676520751306368	1397718243415
247880-	0		1	Sat Dec 04 15:48:34 +0800 2010			4077034983	4077034983				221101204897714583	0		#	2	<a href=" rel="nofollow">UC浏览器</a>	今天情人湾潜水钓鱼一日游，开心！临走拍个照，炫耀一下			1464793945	00	0	1397718243415
247881-	0		3	Thu Feb 14 23:54:51 +0800 2013			3545754842565751	3545754842565751				3545754842565751	0			0	<a href=" rel="nofollow">天语云智能手机大黄蜂</a>	似此星辰非昨夜，为谁风露立中霄。			1464793945	00	0	1397718243416
247882-	0		4	Wed Mar 26 10:49:01 +0800 2014			3692324154173680	3692324154173680				3692324154173680	0			0	<a href=" rel="nofollow">微博 weibo.com</a>	工行信用卡真要逼疯我了，莫名其妙扣了我10块滞纳金，我反应过来应该是没有及时还款。但是从头到尾承诺的短信账单和提醒还款的短信一个都没有。没有主动提供过关联扣款服务，95588要先开通电话银行才能提供咨询服务……和招行的服务比相差真的不是一点点。请问这个会影响征信记录吗？			1464793945	00	0	1397718243416
247883-	0		6	Fri Nov 25 16:48:18 +0800 2011			3383660109318806	3383660109318806				3383660109318806	0			0	<a href=" rel="nofollow">微博 weibo.com</a>	拿到新手机兴奋完了之后，想到下个月要交房租，口袋里已经不剩钱了，于是感到了森森的悲伤……			1464793945	00	0	1397718243416
247884-	0		4	Tue Nov 02 16:42:39 +0800 2010			3398872685	3398872685				231101102457219066	0			1	<a href=" rel="nofollow">微博 weibo.com</a>	(2/2)第二，他们要求我在鹰潭待满7个工作日；但没有说明需要干什么----我又不是犯人凭什么随叫随到？更不要说我是公民，有正当职业，凭什么去香港还需要港澳通行证和边防证了。 另外，看了上面一封信我才知道还有上环一说，这么惨无人道的事情居然还在继续？			1464793945	00	0	1397718243417
247885-	0		24	Tue Jul 17 23:46:32 +0800 2012			3468926518493052	3468926518493052				3468926518493052	0		#	0	<a href=" rel="nofollow">Weico.iPhone</a>	笑话时间又到了！我相信再郁闷一段时间，我一定可以写好的。#写字真的能让人心静##期待早日心如止水#			1464793945	00	0	1397718243417
247886-	0		4	Mon Aug 06 16:08:51 +0800 2012			3476059095916892	3476059095916892				3476059095916892	0			0	<a href=" rel="nofollow">微博 weibo.com</a>	为什么买纸质书不能送电子版呢？@当当网 @当当网李国庆 一淘的比价在书上因为当当的两个新产品迎来了新的挑战：一个是二手书，一个是电子书；在产品节点下提供了更多的选择挺好的，比单纯比价信息量更丰富了；标识清楚些就更好了。尝试引入豆瓣阅读吧。@一淘网			1464793945	00	0	1397718243417
247887-	0		2	Wed May 02 20:45:58 +0800 2012			3441339591368451	3441339591368451				3441339591368451	0			0	<a href=" rel="nofollow">微博 weibo.com</a>	新浪微博是越发不适合装b了，好多话要换个地方才能说。去哪里说呢？			1464793945	00	0	1397718243418
